Review ID,Username,Rating,Review Text,Date
dfe4bc5e-f99e-4783-9822-9d6251ba5421,Kustiono,1,Kalau lagi kendala pasti lama penangannya,2022-11-21 07:59:43
9f11e331-e001-4a4c-bdfc-e01615b9e4c5,Rafa Azka,5,Bagus,2022-11-19 06:13:46
efd57b16-225e-40c2-a50f-8e1a4a41ebea,Rizky Hermawan,5,ok,2022-11-17 14:59:03
4be0d473-e6a9-4ba4-8320-4226fdf76bc6,Dani Ramadani,4,"Tolong dong respon chat nya, karena sudah dua hari ini saya gak bisa memakai internet mati total lampu indikator merah nya nyala terus... Sudah saya hubungi call center tapi tanggapan belum ada sampai saat ini, untuk jadwal kapan di perbaikan nya...",2022-11-15 10:23:44
d44a2b80-6d4e-4340-9b93-2c6521b68e46,Bro sev.ar70,2,"Di selfcare status sudah bayar,di aplikasi masih belum lunas?? Aneh ya bund",2022-11-15 08:43:32
0a1a20e3-f2c9-45ce-b86f-2498c99df124,Denny Prasetyo,1,"Jaringan dari awal pemasangan ga ada bagus2nya. Buat streaming donlod lancar, buat gaming NO banget! Ga ada stabil2nya, nyesel pindah dari indihome",2022-11-11 09:12:12
e5db923a-23da-4a7c-b125-d4673403fc84,Ricky .B.R.,1,"CS slow respon, kga ngerti produk knowledge anehh... Kalau ga loss ya internet ilang",2022-11-09 02:48:47
fde4b39d-6c4d-4e19-8248-167aebbd3593,joko endar,1,Tak bisa login,2022-11-08 02:59:02
36c5ff92-65cd-4cc2-8f92-301b09be96d8,Ade,1,"Malam Pak bu saya udah lama berlangganan . Dan skrang wifi saya troble karna kabel utama putus . Udah chat WA, email dan telepon jawaban nyah sibuk terus . Giliran nunggu disuruh bayar . Giliran ada masalah. So sibuk . Udah 2hari di telepon call Centre sibuk trus WA juga sibuk trus aneh.",2022-11-07 13:52:40
0d5c9fd2-348b-411a-ab59-d9d2cb699ea9,M EFFERY MATHORIDI,1,Kecewa.. Lampu merah los hidup dari kemarin gk ada direspons sama pekerja oxygen.. Intinya sangat.. Sangat kecewa...,2022-11-07 08:13:34
cfff9171-77a1-4afc-842e-13c199f982e4,Muhammad Solikin,1,"Udh bayar untuk pemasang oksigen, hampir 1 minggu belom ada pemasangannya, parah kecewa berat, Baik teknisi maupin seles tidak ada konfrimasi sama sekali. Kalo bisa di balikin dana udh gua ganti sama internet sebelah",2022-11-05 14:36:52
9795dcff-d1f4-4ebf-baf9-f5c9e748dc30,N N,3,Kenapa ya sudah bayar tagihan tapi di aplikasi tertulis belum lunas. Gpp sih cuma jadi gimana gitu liat aplikasinya,2022-11-04 14:30:31
90825b0c-b31e-46e4-a189-9ed24dd4fb32,Budy Saleh,1,KENAPA SERING MATI ? SEKARANG KUNJUNGSN . BSK / LUSA MATI / TDK BS DI GUNAKAN SAMPAI ADA PROSES KUNJUNGAN BERIKUT NYA . DST .,2022-11-03 07:47:00
4a2b236e-f158-439a-bd94-210c2d5d948c,Vazzri priagus Triihwan,1,"Sangat kecewa dengan WiFi inii, kacaw pokonya gabener csnya jga lambat",2022-10-30 08:40:21
cfa5c2fb-0e00-470a-b728-f544d5e6fc9f,Muhammad Panji Irawan,1,"Sampah malah jadi ngelag , ini yang benerin bug codingan nya bingung apa gimana",2022-10-22 18:03:49
5d44387a-49b1-45c4-a69f-15f3e9087757,walid aramico,1,ribet,2022-10-20 13:12:12
3be3b5e8-2950-429d-8184-9c4bf771bef5,BLUE KAZAMA,1,Kenapa setiap buat laporan harus nunggu 3hari baru di tangani...padahal gw bayar tepat waktu... padahal tadi ada teknisi yang dateng beda beberapa rumah aja...kenapa ga sekalian ketempat gw juga kan deket,2022-10-18 11:45:32
eca89089-d872-4312-b1bf-2356245a0659,khaerul anwar,1,"Awal² pemasangan sih oke² aja. Tapi seiring berjalan kadang jaringan nya suka tiba² terputus, respon cs nya baik, namun penanganan di lapangnya sangat lambat. Sudah 1 bulan saya tidak terkoneksi internet padahal on time di awal bulan bayar tagihan. Tapi tim penanganan nya tidak datang² juga, padahal sudah menelfon cs nya berkali².",2022-10-17 10:40:17
a8178cec-707e-4906-ab7c-5978986eb61e,Andre Bagaskara,1,"tolol, internet dicabut tiba tiba, telpon cs katanya berhenti langganan dan perangkat sudah diambil..padahal perangkat masih ada dirumah blm diambil sama sekali. tolol, baru bayar seminggu padahal",2022-10-14 16:20:54
4843fd52-129a-40ad-969b-ad031585b23b,Samuel chandra,1,"Cs lewat whatsapp nya gk jelas gk pernah di bales, tbtb pas di chat kembali malah di suruh selesaikan kan aneh",2022-10-12 14:23:14
e0afc862-8993-487e-a044-b9f32a8bfd8c,Aldyansah Grips,1,"Kalau mau bikin aplikasi itu yang niat, mau reset password aja gak bisa. Mau cek tagihan lewat web juga gak bisa. Mau bayar lewat blibli sam dana status tunggakan sudah dibayar tapi keadaan wifi gak bisa dipake",2022-10-12 01:15:21
d9589390-6de5-48c1-b4da-e727d82f0816,Jory A.Pribadi.T.P,3,"Sebenarnya dan sejujurnya kalau untuk jaringan internet di wilayah domisili saya tinggal sangat bagus dan benar-benar cepat kalau app nya ok tidak ada masalah, tapi hanya dari sisi pelayanan customer service nya saja yang kurang, karena responnya lambat untuk penanganannya, dan sangat kurang solutif",2022-10-10 08:48:20
bcfb9fb3-5395-4881-8b0a-819791a7342d,Anto Budianto,2,"Sudah 5 hari ini masih gangguan blm juga bisa di gunakan,penanganan nya sangat lama.........",2022-10-09 14:20:02
ef979b31-1e0c-4abd-96ec-5a55485ff1dc,al fayyed,1,"Mau komplain susah sekali, lewat whatsapp tidak dibalas, lewat panggilan langsung juga tidak di angkat Payah",2022-10-07 04:54:03
534dd426-a039-4273-b9ba-e8a483b62e64,Jalak Tunda,1,"Niat ga sih buat aplikasi? Reset password malah ga berfungsi...sy beneran nanya nih, niat ga buat aplikasi?",2022-10-03 10:55:57
4544b88a-3daf-4a86-8cc6-9f82f43345f6,Bima Kurniawan,2,Lah malah gk bisa login setelah di update 🥲😟🙃,2022-09-30 05:04:29
e6c5f80a-ad1e-415a-9105-0c2845ac8047,hardy hardy,1,"Internet gak nyala sdh 3 hari, dari pihak CS hanya di minta tunggu,tunggu entah sampai kapan,gila ini perusahaan,yg lain 5-6 jam teknisi sdh sampai rm,,yg ini masa bodoh bgt",2022-09-28 07:46:08
3ba8f4f4-1ebb-49b3-880f-bcb65100f3c2,iREnd goipodhi,5,Mantap,2022-09-21 15:56:14
6b548a39-749d-4866-9cb7-325d45829953,Ronny Amex,5,Sukses selalu....,2022-09-20 16:02:10
66443962-154d-4ec0-ad36-0fbc6a4b2057,Triana Yuli Utami,2,"Setelah update kenapa ga bisa log in ya? Terus belakangan ini jadi lemot banget jaringannya, klo gini mah sama aja kaya Indihome sama sama lemot. Udah gitu klo jaringan bermasalah slow respon banget. Tolong di perbaiki ya agar kami enak mengunakan wifi ini",2022-09-16 15:07:03
50ceb202-6069-42f2-8910-c2640d06df37,Yusuf Khalid,3,"Di update malah gak bisa login,padahal username dan password sdh benar,akhir nya balik lagi ke versi 1.0.7 dan gak error lagi dan berhasil login,kalau masalah jaringan sudah bagus dan gak ada kendala,Terima Kasih 🙏",2022-09-16 04:20:57
e2fe3967-ee7e-45be-b58d-e06ef6580d87,Ninja,1,Harga promo sama tagihan kaga sesuai... Sales nya songong lagi...,2022-09-15 12:58:51
59268d2e-2666-4586-a81e-ebc235327b8f,Dery Caropeboka,1,"Pelayanan lambat, internet sering hilang, tiap bulan, nelpon cs ngabisin pulsa, cs lewat WA ga jelas balasanya! Pelaporan udah 1 minggu ga ada teknisi yg datang, ditlp cs malah jawaban sudah selesai, padahal internet belum bisa! KACAU PARAH!!! Nyesel pake oxygen!",2022-09-14 13:50:13
96092cb1-3ebb-4bef-819a-4a9da49d5baa,Adep Oim,1,"Pelayanannya lelet, lambat, macam keong, Internet no ascses, reset system2 apa kali lah,, gek jelas,,",2022-09-13 03:55:35
b0adbb4e-6a5f-4cdc-aee0-f2ed331ec354,2A_HAMZAH EL HAKIM,1,WiFi cacat ajg udah bayar Internet malah ga Bisa konyol-konyol,2022-09-04 00:33:20
632d4c06-59af-467a-a6d9-87cfa49de1ee,Maulana Ikhsan,1,Lucu dah aplikasinya wkwkw,2022-09-01 14:28:46
d897ef73-9fca-499f-831d-501c6f0d82cb,DieonaKids,1,Update malah ga bisa login ./!!!!,2022-08-30 04:24:12
ff0cd144-8fc8-4f6c-a859-4f970d3fa8bf,JOKO PRASETIO,1,setelah di update malah ga bisa login... sampah,2022-08-28 02:21:27
1e3b9d8b-9b88-4a81-8040-a7c2847e0a93,Roni Rusandi,5,Harga murah speed nya kencang.. Top dah,2022-08-27 03:39:52
95a605e5-0622-4991-b16c-98ded7d0036e,Rachmat Hartono,1,Update malah ga bisa login. Piye toh le le,2022-08-22 04:49:16
23eb11ee-ab53-4093-8d54-313875ee059f,Dwi Haryanti,1,Super duber jelek.Wifi bermasalah udah semingguan.udah komplen tapi ga ada tanggepanNya sama sekali.buruk bangett pelayanannya,2022-08-22 02:33:05
fa36ce5b-6ecf-4035-b60a-f013d09518fc,sepri muslim,5,bagus,2022-08-21 15:42:29
15f74571-d072-4ef5-bb8c-7f228dff01fe,Road Runner,1,TERJELEK,2022-08-19 14:52:58
56e994d3-1ae3-4036-aee1-43fa40ba68fa,ranggi,5,good,2022-08-19 14:24:15
44ba8f02-2b95-4bc5-a0b5-9771fd9bd348,Nikita Rasaki,1,"tanggal jatuh tempo bayar main rubah aja, sengaja dicocokin sama tanggal gajian malah... ah sudah lah",2022-08-16 03:06:56
4f8c4e47-6028-4b23-acb5-fce436191737,maulana dedi supandi,5,Ok,2022-08-15 22:45:18
deb187cf-c4f2-420b-8771-61ac5a01afd7,Dwi Dwi,4,"Tidak bisa lihat tagihan oxigen,pdhl udh upgrade yg terbaru",2022-08-14 15:08:27
af0e2717-5cf5-49f3-9559-df8d3353b1d0,Kang Abay,1,Update terbaru ga bisa login Developer nya stupid,2022-08-13 14:09:06
0771cf57-0f96-4ab7-8476-437a329a261f,Muhammad Nur Wahid,1,"Los Merah, lama penanganannya Klo telat bayar langsung non aktif Buruk",2022-08-13 07:52:34
dd2276b3-6bae-4b0e-8445-8d2198866f7c,Lukman Hakim Ali,1,Gak bisa login,2022-08-09 09:21:16
5b57c081-dbb5-4ada-9c91-1df4d90c1b85,Selamat Manurung,5,Aplikasi Terbaik utk membantu pembayaran Internet Oxigen.,2022-08-08 02:19:28
17580d4b-bc40-406e-88b7-029fb49490d9,Matius Ncl,5,Very helpfull,2022-08-05 12:28:32
8f8fd8aa-3ade-4baf-b1b8-8dc18da99f89,Abie Indonesia,4,Untuk melihat wifi,2022-08-03 10:01:20
0551acb3-3fa4-4025-ad86-d13d9c96710f,TOPABASA TV,1,"Sinyal turun naik ga sesuai, harga naik aja",2022-08-03 03:26:48
3e5867b6-044c-438b-a76a-18777f6682af,Wahyu Prasetyo,5,Membantu,2022-08-01 07:06:27
8c1f7324-2f74-4559-b16e-6905e952d9a8,M Yanuar.W,5,"Terimakasih oxygen, steam dll tidak kena blokir.",2022-08-01 04:03:15
1275a293-6795-4ddd-8806-9f81fbeab1f5,Jeffri Wijaya,5,Top,2022-07-31 07:34:27
e2806184-aac3-45fd-a858-d2cb79eea8dc,Asep Ryand Saputra,1,"Aplikasi sampah, seminggu komplain terus . teknisi datang internet normal 1 hari kemudian internet nga bisa lg.",2022-07-21 04:25:25
f5c659df-40e5-4459-bfe9-704c834162b8,Akbar Satria Putra,1,"katanya sistem otomatis, layanan aktif kembali tiap bulan setelah pembayaran tagihan, tapi mennganggap customer tidak melakukan pembayaran dari bulan april ! tidak ada solusi dan jawaban yg sesuai dari CS",2022-07-17 06:24:26
1165be09-2eac-4a2c-a4ed-ed99b9607614,Ucii Susinta,1,Lambat,2022-07-11 14:39:21
4294af9e-8e41-4c7c-8335-3654c59bfb1f,Ambrosius PetI,1,"Komplen hari ini bals minggu depan, asw",2022-07-11 03:02:26
0ed354bc-04cd-447a-8f04-0591f09ea7ed,Dark Rodex,1,"LOS LOS LOS LOS parah bgt, balum ada 1 hari pemakaian masa udah berkendala kedip merah LOS. Salesnya low respon bgt, dichat ke teknisinya harus ada WO baru bisa meluncur. Menghadeuh...",2022-07-10 09:39:22
3159b17d-9180-46ad-8aca-d0f4377d1141,Pringga Nur Julia Rahman,1,"ketika ada gangguan internet penanganan nya lama, customer service semua slow respon banget banget, cuma disuruh nunggu.",2022-07-09 16:32:06
42697823-b6ef-4d59-b2eb-b8a6a28be345,Salim Moahmad,5,Penanganan lumayan,2022-07-09 11:01:43
0696f84b-85c1-483a-9316-09108ad4323e,Sodik Alkaf,1,Aplikasinya ngebug terus..susah untuk mengecek tagihan pembayaran internet,2022-07-08 06:23:43
69e281cf-adef-4b28-b61a-a2cd8e58d40d,Fairi Official,1,Tv kabel + internet loading trs..nontonpun gk jelas muter mulu. Udah complain masih tetep aja.,2022-07-07 17:29:19
c48865b7-271b-4cb1-b60c-f61e68026a11,Maul Maulana,5,"pernah ada masalah loss 1x,tlp ke Cs.. besoknya langsung perbaikan dan beres. Gw langganan udh 2 tahun lewat , jarang bgt ada masalah jaringan. T.O.P Oxygen.id",2022-07-06 08:04:38
d85aa988-971f-4eec-a547-b5b498403295,Aang Chunaivi,1,"Parah, respon kendala Los koneksi lemot, dah di aduin lewat whatsapp disuruh nunggu 3x24 jam tapi kaga ada sama sekali respon sama teknisinya sampe sekarang, giliran di telpon malah di suruh nunggu lagi 3x24jam, ini lagi ngajak berantem sama konsumennya apa? Gunanya WA sama telp apa coba ngurus keluhan pelanggan aja lelet..",2022-07-06 07:16:26
faf81780-e90f-4a5b-a637-4f54197e8b36,4D3H4 TM,1,sering gangguan n layanan nya tidak bagus n lama,2022-07-01 06:12:45
1b37dac7-08be-4e92-bcb8-cec5e310c590,Jordan Setiawan,1,Kok saya buka aplikasi ini keluar sendiri gimna yah ini ????...... Aneh bet,2022-06-30 12:17:29
d83c9980-765b-4406-a82a-d4e32625b4f2,Ary Firansyah,2,"Mau sampe kapan kaya gini? Kalau mau jualan jasa, pelanggan dipelihara dong Apps ngebug mulu Internet cukup, cukup lambat speednya ga sesuai. Gimana mau maju? klo gini terus ya jadi banyak disumpahin pelanggan.",2022-06-21 00:17:53
8a9e708a-05d0-4c15-b6db-18b0648e8b8f,Irvin aja,2,ini mau ngecek invoice knpa keluar terussssssss... gmna mau bayarr pembayaran woyyy benerin lahh pada malesss amat kerjanya,2022-06-20 19:41:46
928103c7-63ed-4ec2-8440-fd0a01ac5bce,lukman tara,1,Penanganan Keluhan pelanggan buruk Kota Bogor Utara. Mohon ada WA keluhan pelanggan. Teknisi siap kapan saja tidak tunggu besok dan lusa.,2022-06-19 14:56:44
8daaabf7-935a-4d9f-bac4-6fdad3cb2ab8,Hilmi 10,1,"Ketika ada gangguan internet penanganannya lambat , mengecewakan lah",2022-06-18 05:10:58
3290b25a-b792-41c5-adb6-a0aa3426422c,ra asdad,1,"Provider yg sering ada masalah, proses perbaikan lebih dari 1 minggu dan masih los sampai saat ini, dan sama sekali tidak peduli dengan kepuasan customernya, harus pikir2 1000x lagi deh buat langganan provider ini!",2022-06-11 20:47:10
aef5a93d-c4c0-40bc-8a39-f49645c85122,M Rifqi Darmawan,2,"Kalo emang mau update tinggal kasi peringatan, mao gua buka cek masa tenggang aja keluar""an mulu gmn si TUMAN.",2022-06-09 08:09:28
208caa2f-10e0-42cd-9a52-89dc976d13d1,megha wati,1,ini mau liat tagihan knp gk bisa yah ? Aplikasinya keluar2 trs ini ...,2022-06-08 13:19:40
2a3600e3-81e7-4f25-919e-5a5daddf0955,Humaidi Fikri,1,"Cs slow respon dan sulit dihubungi ketika gangguan , perbaikan gangguan lama bisa seharian",2022-05-30 05:47:01
7d064a47-b965-45fd-9407-9e8ca30bbe43,Rofi Saeful,1,"Parah, makin parah, sering loss! Costumer service ga ada yang jawab",2022-05-28 02:43:59
a3063c8a-6fc4-4bff-9eb3-9fa47b3d2c92,Sutter Ibnu said,1,"Di awal salesnya bilang paket yg 50mbps dengan harga 2xx.xxx flat, setelah setahun harga naik 3xx.xxx (oke ga apa2 harga naik) eeehhhhh.... Sekarang bukan 50 mbps lagi. Dikurangi jadi 25 mbps, setelah komplain, katanya 50 mbps promo untuk 1 tahun. udah gitu sering down, TV sering lag. Jawab keluhan para customermu, kalo ga ingin ditinggalin",2022-05-25 13:47:25
82a650a8-9533-4891-9411-62399bf45de2,za kia,1,wifi udah tiga hari loss. udah di kabari di telpon di chat servisnya ngga di respon telpon ngga di angkat wa di read doang hadeeh. pelayannya kurang banget 😩,2022-05-25 06:52:28
a9e9693c-009c-4b61-aebe-0e1dce7e9361,nova Yuliantina,5,Bagusss WiFi okee,2022-05-23 11:30:32
112875e3-4b85-4c6d-8c21-73618c55a1d1,Anugrah Bdwiputra,1,"Internet buruk,. Sehabis hujan internet tidak bisa, mau melaporkan saja harus menelpon pakai pulsa? Seharusnya harus ada customer service untuk melaporkan masalah internet nya!! Mungkin bisa by gmail atau bikin lagi untuk melaporkan masalah internet nya.",2022-05-22 02:11:30
2eeb380a-a12a-45d6-a6fd-e4b1e893a1b3,Anggun Rahayu,1,"Oxigen makin gabisa di andelin, dulu saya pasang karna harga yang dikasih sangat terjangkau dan kualitasnya nggak kalah sama yang lain tapi setelah harga di perbarui jadi 327.500 bukannya makin bagus malah makin payah, mulai dari jaringannya ngerestart sendiri jadi ZTE ( SUDAH 2X BEGINI) , REMOT YANG DI PAKE MINTA DI CONECTING TERUS, JARINGANNYA SERING LOST MERAH, WIFI SUKA LEMOT, INVOICE TIDAK PERNAH MASUK KE EMAIL YANG TERDAFTAR, silahkan di ambil aja lagi ini alatnya, GAK GUNA!",2022-05-21 16:09:28
e5aeb2e1-6eb3-4d63-9705-89b934a84836,King shu,1,"Makin ksni kok bukanya makin bagus tp makin sering eror jaringan, los merah mllu, mana proses perbaikannya lama, dan aplikasi ini ga ada gunanya, cm buat payment doank untuk apa ??? Harusnya ada fitur buat pengaduan masalah biar cepat ditanggapi dan diperbaiki. Harusnya di cek secara berkala tiap terminal box nya, jgn nunggu ada laporan error baru di cek",2022-05-17 20:32:11
800be417-d9d3-4d90-965b-05a8f9ac23c0,Yuliansyah Eka Putra,1,"Mau tau knp tagihan gw bisa kena smpai 700rb, krna odo buat koneksinya dr rmh gw jaraknya 213 meter yaitu lebih dari 150 meter kabel free dan mencari biaya goib dari 63 meter kabel tambahan yang dihitung 63 meter x 6rb = 378rban.. Dan itu teknisi tidak bilang klo kabel tambahan 63 meter masang dimna tuh... 213 m tuh lumayan jauh, gak sanggup bayar gaji teknisi jangn begini caranya anjir.....",2022-05-16 14:18:48
7195e752-39b1-41b4-bcb7-8acfe9e28c92,Ralabuma Mania,1,"Hai Kak, sesuai dengan nomor laporan 818042 akan dilakukan kunjungan perbaikan ke kediaman Kakak pada hari Kamis, 12 Mei 2022. Mohon bantuannya nomor telpon yang terdaftar selalu dalam keadaan aktif guna mempermudah tim terkait konfirmasi perihal kunjungan perbaikan. Terima Kasih ~ NYASAR KEMANA GAK PERNAH DATANG HOAX DOANG 2 MINGGU MATI KOMPENSASI NYA APA UDAH RUGI PULSA",2022-05-14 10:11:53
7b078da5-b9bb-482f-a1c6-aea838408b97,Ailam,1,Tidak terhubung dengan internet,2022-05-13 13:45:18
6fbf1ba9-04fd-47e2-b842-e2cbfeccf06d,Julio Hady Alfatah,1,"pelayanan sangat buruk, internet sering los, kabel sering diputus, apalagi respon selles nya 👎",2022-05-10 04:54:54
24f8c284-8cd9-4645-8d90-ece891a47f50,Bobs,1,"Pelayanan gak bermutu...dari mulai internetnya, cs dan teknisi, semua ga profesional menangani permasalahan internet. Baru install 2 bulan udah ada aja masalah setiap hari Sabtu dan Minggu. Tiap masalah teknisi suruh Dateng 3-5 hari, jadi tiap weekend ga bisa dong pake internetnya...trus hari kerja ya ga kepake dong internetnya ..picik bgt sih bisnis nya. Moga2 cepet bangkrut kalian...amin.",2022-05-07 10:45:44
ff4ea00a-a686-429c-9ccc-cc0a2a38bc12,Tik Tik,1,"Ancur,setiap bulan pasti Lampu indikator LOS menyala,,masa kendala setiap bulan kawan ,,tolonglah perbaiki layananya",2022-05-03 09:09:51
ee743295-01f1-4e6f-9b9d-2a37e7156c90,Rudy Achmad,1,Cuma untuk cek tagihan dan bayar saja. CS cuma pajangan gak pernah online.,2022-04-30 05:58:40
98b48f74-aafd-4d80-b9de-33e5f59489a8,copper_ iL,1,Makin lama makin hancur nyesel bner masangnya 😂😂,2022-04-30 05:29:51
aa7b853b-d865-44ab-a683-59e6afb437c9,Pusvita Fadhilah,1,"PARAH BGT BARU BYR LGSG MATI, UDA TIGA HRI INI MATI, GAADA JAWABAN JUGA , KACO BANGET , PELAYANAN NYA JUGA LELET, DM GA DI BLS , KOMENTAR DI IG DI BATASI , GA REKOMEND BGT KLO KE GINI MAH.",2022-04-29 04:28:02
aa959506-d18d-42af-aa4e-d24e738f0b3f,Iman Surya,1,"Provider ampas, pelangganmu di anggap enteng. Saya tidak akan pernah merekomendasikan provider ini ke orang lain, kalau ada opsi tidak ada bintang saya lebih memilih itu ketimbang memberi satu bintang.",2022-04-29 02:26:30
d45680a5-4740-4578-bd20-dd96cd4d9d0f,Pramusinta Anggara,1,Aplikasi jelek. Ga bisa kirim keluhan. Ga guna.,2022-04-27 14:33:40
8d7e374f-1bec-465d-927e-41f21977386c,Rai Wirya,1,"Pelayanan lambat sekali, ada kerusakan harus nunggu 3 hari baru respon, parah",2022-04-25 02:54:44
9ec93bfa-79fb-4443-adf5-70e0fa481409,henda alfian,1,Mengecewakan.. tiap abis magrib-pagi selalu lost.. siang tiba2 connect.. tiap hari begitu udh hampir 2minggu berlangsung. Sampe bosen tlp CS.. ga bs diandalkan. Cut aja lah.,2022-04-22 15:45:31
07754649-4567-4fe4-a3fc-86c783a66f05,qiiao,1,"makasih oxygen,berkat sinyal oxygen saya ga dapet nilai tes, makasih banyak atas kata ""tidak ada internet "" kemarin",2022-04-21 03:54:04
0f250234-7ed9-40ff-80f3-bf47d2e91283,common rider,1,"Makin kesini makin ga jelas sinyal nya,,,",2022-04-19 19:06:20
d6eccfb4-a47d-47c3-9b41-d4877525c840,Abimanyu Kimtan,5,alhamdullilah lancar jaya,2022-04-17 07:41:34
a336ff5e-7420-4d0f-95b9-ca1cbd7132cb,Titiek27,5,"Sy pelanggan Oxygen sdh 3 THN tp makin kesini sering bgt down. Dari jam 3.30 subuh down di kotak indikator lampu 2 hijau, yg ditengah merah kedut2 terus. Udah hub via WhatsApp Oxygen katanya petugas akan menghubungi, sampai skrng gak ada kbrnya. Knapa Oxygen sering bgt down ya.....",2022-04-12 08:04:14
c8c978a3-d345-4990-bd8f-2b64bb1747ed,Faiz Abdillah,1,"Giliran tagihan aja cepet, tapi giliran keluhan lama hahahaha, gaada beda nya ama sebelah 😏 niat mau masang buat tempat tinggal ortu dan kosan gajdi deh klo begini, blacklist!!!",2022-04-10 05:29:17
a3ffde70-69f2-4959-9f91-916782856309,Denny Farioza,5,"Layanannya jaringan internet ok, tapi sayangnya saat chat dengan cs balesnya lama banget. Apakah ga punya sop untuk merespon konsumen yang lagi bertanya atau mengeluh",2022-04-07 06:12:43
89bd770f-f6ec-4d0f-b52b-841c88256ec0,Al Farisi,1,Kacau pelayan an nya,2022-04-06 08:39:11
9dacebff-9d2b-4853-a094-d196e722dfdb,imam kadhafi,1,Ini kenapa sinyal nya sering down gini sih? Udah hampir 2 hari sinyal gak jelas,2022-04-06 07:20:22
7ab4f0df-f2a1-4edf-b834-da3467fb2019,Rise Shine,1,"Saya pelanggan Oxygen sejak 3 tahun yang lalu. Beberapa bulan belakangan koneksi internet sering bermasalah. Sering terputus-putus, kalaupun ada koneksi jaringannya lambat. Seperti memakai 2G!. Parah sekali. Dulu tidak seperti ini. Dan aplikasi ini hanya untuk billing. Untuk pembayaran. Yg dibutuhkan pelangga adalah ketersediaan layanan. Ini tidak disediakan oleh manajem. Aplikasi ini mencerminkan betapa tertutupnya Oxygen terhadap keluhan pelanggan.",2022-04-06 03:57:02
daa68de6-2e35-427c-bf69-074877d834b8,Rachmawati (Rachma_alshaken),2,"Kok jdi lemot ya. Bka youtube ngadat"" Mulu",2022-03-23 00:06:35
ef66b946-71fd-421f-abbe-ddd33791f655,Muhammad Fadly Aliansyah,1,Ga rekomen,2022-03-21 12:01:48
d50a2950-fca6-44b2-bc95-5c4b14ba6c1f,Dozk,1,"Alaaah, sales bilang bisa tiba tiba teknisi dateng bilang ga bisa, mau pengembalian dana bilang 14hari kerja udah 15hari dana belum di refund juga, untung apa nipu dek",2022-03-15 02:43:58
bacf86a3-7077-44a7-b9c6-59ee8e4a7410,Ra Ma,1,"Kabel loss kedip2 merah, gak ada perbaikan udh 6 hari di tnggu² , pas mau pasang gesit amat dtang krumah eh lalu di suruh bayar pas bayar kabel loss, wifi macam apa ini? Udah lelet, perbaikan nya lamak pula",2022-03-13 06:12:27
531b217f-2ccc-437e-987f-f646802555f4,agung raharjo,1,"dulu pas pertama mau pasang....saya pilih pilih mana yang terbaik..jatuhlah pilihan ke oxygen.id....salesnya pun langsung pada baik baik....tapi sekarang malah terbalik...jaringan hampir setiap bulan gangguan terus.dari lampu routernya LOS.kadang kabel ada yang nukar./putus,sampai roter normal.tapi tidak ada jaringan...hubungi sales,nanti mau dilihat,tapi ga dtg dtg.hubungi CS, harus nunggu 3/4hari . kadang sampai seminggu....kalau memang terus seperti ini..kayaknya pilih ke provider lain saja.",2022-03-12 11:35:40
fbc11344-b422-4ef8-a0f3-b7365ccd8c7e,Andi Wijaya Saputra,1,"sudh bayar 260rb 3hr wifi mati, kalo mau aktif bayar lagi 302rb/tagihan baru... situ sehat... !!! cari duit yg halal bos... nipu custemer klo bgtu namanya.",2022-03-11 19:14:20
05cd7560-82f8-46be-ae46-e474bb7826f3,Vembry Wahyu,1,"PARAH SEKALI pelayanannya,bayar tanggal 1 katnya di pastikan pasang tanggal 3,setelah teknisi datang bilang sinyalnya ada masalah harus mnta orang jaringan benerin ( tim jaringan sabtu minggu libur ), tanggal 7 di telp lg klo jaringan sudah oke tanggal 8 siap di pasang,belum sempet pasang udh d telp lg klo sinyalnya masih ada masalah. Kacau. . . . .",2022-03-08 07:56:33
8a6d1e18-31ab-459e-9788-58e053b1614e,Herry Cahyono,1,Oxygen kenapa sering banget down ya belakangan ini..?? Suka tiba2 hilang jaringan internetnya.. huuft.. Sudah banyak yang mengeluhkan sampe rating nya pun anjlok.. tapi koq seolah ga ada tindakan untuk perbaikan.. Padahal harganya sudah hampir sama dengan kompetitor.. bukannya makin baik tapi malah makin turun kualitasnya.,2022-03-03 10:50:58
c5ba0fb6-4eec-4c52-a799-0c4d6a9c4918,Bro Ian,1,"Payah ini , waktu awal dibilang bukan harga promo, sekarang tetiba harga naiknya edan..",2022-02-27 13:18:07
59e7b342-3332-4866-ad16-f212be5ac158,Erland Lohy,1,"LOS MERAH sudah 3 hari dari hari Kamis tanggal 24 Februari 2022 sampai sekarang Bikin laporan tidak ada tanggapan sampai sekarang Lapor lewat WA malah di block Jangan nipu pelanggan lah, kasih harapan palsu terus, dengan tagihan datang terus, tapi pelayanan KAYAK TOKAI",2022-02-26 08:39:00
ba1fe79d-5964-4889-b050-8b3392826c43,Zainal Muttaqin,1,"ini ko aneh ya Wifi sekelas oxygen punya sistem seperti tu saya kan cuman minta pengajuan penambahan Mbps tpi ga bisa , harus menggunakan sistem pemasangan baru.buat apa saya berlangganan tpi tidak bisa upgrade.waktu pemasangan baru aja saya sudah kena 400rban dari team lapangan nya.ko sekarang pelayanan jadi buruk begini ya.bukan nya nyenengin pelanggan malah mencari keuntungan swndiri busuk banget caranya.",2022-02-26 07:56:10
03dc74af-e190-41d3-9337-6bc831da8505,Munawir Haris,1,Pelayanan...paling buruk...iptv baru umur sehari..sudah error gak bisa di pakai..ngadu sana sini gak ada tanggapan...,2022-02-26 05:25:57
0a99c8cf-179b-47d5-b08d-3e40d77f1fee,Rizky Putri Yani,1,"Saya sudah nonaktifkan jaringan untuk 1 bulan, dan pihak cs tidak bilang kalau tagihan saya double, dan tbtb saya bayar tagihan bulan berikutnya tapi baru pakai seminggu sudah dimatikan dengan alasan untuk bayaran 1bulan kmrn, pdhl itu sudah dinonaktifkan. Duh jd butung gunanya cs untuk apa ya kalau cuma bisa nipu customer. Pindah ke tempat lain. Kecewa bgt",2022-02-24 06:50:05
6e9d628b-4bbe-4a5d-abd4-c0123ab339fd,CANDRA RIZKY,1,Pasangan Wifi Bulan Rp 249.000 Murah Dulu sekarang Bulan Jadi Harga Naik Rp 306.000 Mahal Gila Putus Wifi buang,2022-02-20 07:34:06
a107bedd-e131-419c-988b-2939ae8f5008,didi darmawan,1,Makin ke sini makin sering down. Dari 4 februari sampe 17 februari blm ada tim terkait yg berkunjung.,2022-02-17 08:08:29
60f3b5dc-0967-41be-94cc-0d7d4952de5d,Ole Thurgen,1,Kalo ada kendala cs dan teknisi nya cuma bilang mau datang datang doang tapi giliran urusan pembayaran telat 1 jam aja langsung di matikan internet nya wkwk.,2022-02-03 13:31:32
910ec1fc-746e-48ec-9a3c-fd9f8079d800,Risma Fakriah,1,"Pelayanannya sangat lambat, saya chat dari tanggal 25 sampai hari ini masih tidak ada respon yang baik juga. Malah disuruh nunggu nunggu terus",2022-02-01 13:14:52
74f2bad0-28af-4846-bad9-436b46ef4f03,HJ Asnidar,5,Bogor,2022-01-24 14:09:42
